{
  "run_id": "example-web-app-001",
  "timestamp": "2025-01-15T14:20:00.000Z",
  "brief": "Develop a modern web application for task management with user authentication, real-time collaboration, and mobile responsiveness. The application should support teams of up to 50 users with basic reporting features.",
  "project_overview": {
    "title": "Task Management Web Application",
    "description": "A comprehensive task management web application featuring user authentication, real-time collaboration capabilities, and responsive design for modern teams",
    "objectives": [
      "Create intuitive task management interface",
      "Implement secure user authentication system",
      "Enable real-time collaboration features",
      "Ensure mobile-responsive design",
      "Support up to 50 concurrent users",
      "Provide basic reporting and analytics"
    ],
    "success_criteria": [
      "User registration and login functionality working",
      "Tasks can be created, updated, and deleted",
      "Real-time updates across multiple users",
      "Mobile-friendly interface on all screen sizes",
      "System handles 50+ concurrent users",
      "Basic reports accessible to admin users"
    ],
    "total_duration": 56.0,
    "total_cost": 168000.0,
    "start_date": "2025-02-01",
    "end_date": "2025-03-29"
  },
  "wbs": {
    "phases": [
      {
        "id": "phase_1",
        "name": "Project Setup & Planning",
        "description": "Initial project setup, requirements analysis, and technical planning",
        "start_date": "2025-02-01",
        "end_date": "2025-02-07",
        "tasks": [
          {
            "id": "task_1_1",
            "name": "Project Initialization",
            "description": "Set up project structure, version control, and development environment",
            "duration": 2.0,
            "duration_unit": "days",
            "effort": 16.0,
            "cost": 4800.0,
            "priority": "high",
            "status": "not_started",
            "assigned_resources": ["project_manager", "tech_lead"],
            "deliverables": ["Project repository", "Development environment", "Project charter"]
          },
          {
            "id": "task_1_2",
            "name": "Requirements Analysis",
            "description": "Detailed analysis of functional and non-functional requirements",
            "duration": 3.0,
            "duration_unit": "days",
            "effort": 24.0,
            "cost": 7200.0,
            "priority": "critical",
            "status": "not_started",
            "assigned_resources": ["business_analyst", "ui_designer"],
            "deliverables": ["Requirements document", "User stories", "Acceptance criteria"]
          },
          {
            "id": "task_1_3",
            "name": "Technical Architecture",
            "description": "Design system architecture and select technology stack",
            "duration": 2.0,
            "duration_unit": "days",
            "effort": 16.0,
            "cost": 4800.0,
            "priority": "high",
            "status": "not_started",
            "assigned_resources": ["tech_lead"],
            "deliverables": ["Architecture diagram", "Tech stack selection", "Database design"]
          }
        ]
      },
      {
        "id": "phase_2",
        "name": "Backend Development",
        "description": "Server-side development including APIs, database, and authentication",
        "start_date": "2025-02-08",
        "end_date": "2025-02-28",
        "tasks": [
          {
            "id": "task_2_1",
            "name": "Database Setup",
            "description": "Design and implement database schema with proper indexing",
            "duration": 3.0,
            "duration_unit": "days",
            "effort": 24.0,
            "cost": 7200.0,
            "priority": "high",
            "status": "not_started",
            "assigned_resources": ["backend_developer"],
            "deliverables": ["Database schema", "Migration scripts", "Test data"]
          },
          {
            "id": "task_2_2",
            "name": "Authentication System",
            "description": "Implement secure user registration, login, and session management",
            "duration": 4.0,
            "duration_unit": "days",
            "effort": 32.0,
            "cost": 9600.0,
            "priority": "critical",
            "status": "not_started",
            "assigned_resources": ["backend_developer"],
            "deliverables": ["Auth endpoints", "Password encryption", "Session management"]
          },
          {
            "id": "task_2_3",
            "name": "Core API Development",
            "description": "Build REST APIs for task management operations",
            "duration": 8.0,
            "duration_unit": "days",
            "effort": 64.0,
            "cost": 19200.0,
            "priority": "critical",
            "status": "not_started",
            "assigned_resources": ["backend_developer", "api_developer"],
            "deliverables": ["Task CRUD APIs", "User management APIs", "Team APIs"]
          },
          {
            "id": "task_2_4",
            "name": "Real-time Features",
            "description": "Implement WebSocket connections for real-time collaboration",
            "duration": 5.0,
            "duration_unit": "days",
            "effort": 40.0,
            "cost": 12000.0,
            "priority": "medium",
            "status": "not_started",
            "assigned_resources": ["backend_developer"],
            "deliverables": ["WebSocket server", "Real-time events", "Connection management"]
          }
        ]
      },
      {
        "id": "phase_3",
        "name": "Frontend Development",
        "description": "User interface development with responsive design",
        "start_date": "2025-02-15",
        "end_date": "2025-03-14",
        "tasks": [
          {
            "id": "task_3_1",
            "name": "UI Framework Setup",
            "description": "Set up React application with routing and state management",
            "duration": 2.0,
            "duration_unit": "days",
            "effort": 16.0,
            "cost": 4800.0,
            "priority": "high",
            "status": "not_started",
            "assigned_resources": ["frontend_developer"],
            "deliverables": ["React app", "Routing setup", "State management"]
          },
          {
            "id": "task_3_2",
            "name": "Authentication UI",
            "description": "Create login, registration, and user profile interfaces",
            "duration": 4.0,
            "duration_unit": "days",
            "effort": 32.0,
            "cost": 9600.0,
            "priority": "high",
            "status": "not_started",
            "assigned_resources": ["frontend_developer", "ui_designer"],
            "deliverables": ["Login forms", "Registration flow", "Profile pages"]
          },
          {
            "id": "task_3_3",
            "name": "Task Management Interface",
            "description": "Build main task management dashboard and forms",
            "duration": 8.0,
            "duration_unit": "days",
            "effort": 64.0,
            "cost": 19200.0,
            "priority": "critical",
            "status": "not_started",
            "assigned_resources": ["frontend_developer", "ui_designer"],
            "deliverables": ["Task dashboard", "Task forms", "Task lists"]
          },
          {
            "id": "task_3_4",
            "name": "Real-time Integration",
            "description": "Integrate WebSocket connections for live updates",
            "duration": 3.0,
            "duration_unit": "days",
            "effort": 24.0,
            "cost": 7200.0,
            "priority": "medium",
            "status": "not_started",
            "assigned_resources": ["frontend_developer"],
            "deliverables": ["WebSocket client", "Live updates", "Connection status"]
          },
          {
            "id": "task_3_5",
            "name": "Responsive Design",
            "description": "Ensure mobile-friendly design across all screen sizes",
            "duration": 4.0,
            "duration_unit": "days",
            "effort": 32.0,
            "cost": 9600.0,
            "priority": "medium",
            "status": "not_started",
            "assigned_resources": ["frontend_developer", "ui_designer"],
            "deliverables": ["Mobile layouts", "Responsive CSS", "Cross-device testing"]
          }
        ]
      },
      {
        "id": "phase_4",
        "name": "Testing & Quality Assurance",
        "description": "Comprehensive testing and bug fixing",
        "start_date": "2025-03-10",
        "end_date": "2025-03-21",
        "tasks": [
          {
            "id": "task_4_1",
            "name": "Unit Testing",
            "description": "Write and execute unit tests for all components",
            "duration": 4.0,
            "duration_unit": "days",
            "effort": 32.0,
            "cost": 9600.0,
            "priority": "high",
            "status": "not_started",
            "assigned_resources": ["qa_engineer"],
            "deliverables": ["Unit test suites", "Test coverage report", "Automated tests"]
          },
          {
            "id": "task_4_2",
            "name": "Integration Testing",
            "description": "Test API integrations and data flow between components",
            "duration": 3.0,
            "duration_unit": "days",
            "effort": 24.0,
            "cost": 7200.0,
            "priority": "high",
            "status": "not_started",
            "assigned_resources": ["qa_engineer"],
            "deliverables": ["Integration tests", "API test suite", "Data validation"]
          },
          {
            "id": "task_4_3",
            "name": "User Acceptance Testing",
            "description": "Conduct end-to-end testing with stakeholder feedback",
            "duration": 3.0,